{
  "authority": "docs/specs/GH704/resource_ledger_model.json",
  "version": 1,
  "dimensions": ["entries", "bytes", "segments", "segment_bytes", "per_source_quota", "physical_bytes"],
  "resource_kinds": [
    "registry_live_slot", "keyed_receipt_slot", "completed_index", "outbox",
    "quarantine_frozen_lag", "success_history", "global_admin", "project_wal_live",
    "project_wal_scratch", "derived_log_live", "derived_log_scratch",
    "canonical_journal_live", "canonical_journal_scratch"
  ],
  "exact_scopes": ["global", "source_alpha", "source_beta", "project_alpha", "project_beta"],
  "tuple_expansion_grammar": {
    "version": 1,
    "selector_reference": "tuple_set_id",
    "finite_only": true,
    "forbidden_tokens": ["angle_bracket_placeholder", "wildcard", "pipe_alternative", "pseudo_not_applicable", "symbolic_all"]
  },
  "tuples": [
    {"id":"registry_source_alpha","resource_kind":"registry_live_slot","scope_id":"global","quota_partition_id":"source_alpha","root_id":"global_control_root","physical_domain":"global_control_volume","maxima":{"entries":1,"bytes":4096,"segments":0,"segment_bytes":0,"per_source_quota":1,"physical_bytes":8192}},
    {"id":"registry_source_beta","resource_kind":"registry_live_slot","scope_id":"global","quota_partition_id":"source_beta","root_id":"global_control_root","physical_domain":"global_control_volume","maxima":{"entries":1,"bytes":4096,"segments":0,"segment_bytes":0,"per_source_quota":1,"physical_bytes":8192}},
    {"id":"receipt_source_alpha","resource_kind":"keyed_receipt_slot","scope_id":"source_alpha","quota_partition_id":"receipt_live","root_id":"global_control_root","physical_domain":"global_control_volume","maxima":{"entries":2,"bytes":8192,"segments":0,"segment_bytes":0,"per_source_quota":2,"physical_bytes":16384}},
    {"id":"receipt_source_beta","resource_kind":"keyed_receipt_slot","scope_id":"source_beta","quota_partition_id":"receipt_live","root_id":"global_control_root","physical_domain":"global_control_volume","maxima":{"entries":2,"bytes":8192,"segments":0,"segment_bytes":0,"per_source_quota":2,"physical_bytes":16384}},
    {"id":"completed_source_alpha","resource_kind":"completed_index","scope_id":"global","quota_partition_id":"source_alpha","root_id":"global_control_root","physical_domain":"global_control_volume","maxima":{"entries":2,"bytes":4096,"segments":0,"segment_bytes":0,"per_source_quota":2,"physical_bytes":8192}},
    {"id":"completed_source_beta","resource_kind":"completed_index","scope_id":"global","quota_partition_id":"source_beta","root_id":"global_control_root","physical_domain":"global_control_volume","maxima":{"entries":2,"bytes":4096,"segments":0,"segment_bytes":0,"per_source_quota":2,"physical_bytes":8192}},
    {"id":"outbox_source_alpha","resource_kind":"outbox","scope_id":"global","quota_partition_id":"source_alpha","root_id":"global_control_root","physical_domain":"global_control_volume","maxima":{"entries":2,"bytes":8192,"segments":0,"segment_bytes":0,"per_source_quota":2,"physical_bytes":16384}},
    {"id":"outbox_source_beta","resource_kind":"outbox","scope_id":"global","quota_partition_id":"source_beta","root_id":"global_control_root","physical_domain":"global_control_volume","maxima":{"entries":2,"bytes":8192,"segments":0,"segment_bytes":0,"per_source_quota":2,"physical_bytes":16384}},
    {"id":"quarantine_source_alpha","resource_kind":"quarantine_frozen_lag","scope_id":"global","quota_partition_id":"source_alpha","root_id":"global_control_root","physical_domain":"global_control_volume","maxima":{"entries":2,"bytes":8192,"segments":0,"segment_bytes":0,"per_source_quota":2,"physical_bytes":16384}},
    {"id":"quarantine_source_beta","resource_kind":"quarantine_frozen_lag","scope_id":"global","quota_partition_id":"source_beta","root_id":"global_control_root","physical_domain":"global_control_volume","maxima":{"entries":2,"bytes":8192,"segments":0,"segment_bytes":0,"per_source_quota":2,"physical_bytes":16384}},
    {"id":"history_source_alpha","resource_kind":"success_history","scope_id":"global","quota_partition_id":"source_alpha","root_id":"global_control_root","physical_domain":"global_control_volume","maxima":{"entries":2,"bytes":8192,"segments":0,"segment_bytes":0,"per_source_quota":2,"physical_bytes":16384}},
    {"id":"history_source_beta","resource_kind":"success_history","scope_id":"global","quota_partition_id":"source_beta","root_id":"global_control_root","physical_domain":"global_control_volume","maxima":{"entries":2,"bytes":8192,"segments":0,"segment_bytes":0,"per_source_quota":2,"physical_bytes":16384}},
    {"id":"admin_live","resource_kind":"global_admin","scope_id":"global","quota_partition_id":"admin_live","root_id":"global_control_root","physical_domain":"global_control_volume","maxima":{"entries":2,"bytes":16384,"segments":0,"segment_bytes":0,"per_source_quota":2,"physical_bytes":32768}},
    {"id":"adoption_scratch_a","resource_kind":"global_admin","scope_id":"global","quota_partition_id":"adoption_scratch_a","root_id":"global_control_root","physical_domain":"global_control_volume","maxima":{"entries":2,"bytes":16384,"segments":0,"segment_bytes":0,"per_source_quota":2,"physical_bytes":32768}},
    {"id":"adoption_scratch_b","resource_kind":"global_admin","scope_id":"global","quota_partition_id":"adoption_scratch_b","root_id":"global_control_root","physical_domain":"global_control_volume","maxima":{"entries":2,"bytes":16384,"segments":0,"segment_bytes":0,"per_source_quota":2,"physical_bytes":32768}},
    {"id":"wal_live_alpha","resource_kind":"project_wal_live","scope_id":"project_alpha","quota_partition_id":"wal_live","root_id":"project_alpha_storage_root","physical_domain":"project_alpha_volume","maxima":{"entries":2,"bytes":32768,"segments":2,"segment_bytes":32768,"per_source_quota":0,"physical_bytes":65536}},
    {"id":"wal_live_beta","resource_kind":"project_wal_live","scope_id":"project_beta","quota_partition_id":"wal_live","root_id":"project_beta_storage_root","physical_domain":"project_beta_volume","maxima":{"entries":2,"bytes":32768,"segments":2,"segment_bytes":32768,"per_source_quota":0,"physical_bytes":65536}},
    {"id":"wal_scratch_alpha_a","resource_kind":"project_wal_scratch","scope_id":"project_alpha","quota_partition_id":"wal_scratch_a","root_id":"project_alpha_storage_root","physical_domain":"project_alpha_volume","maxima":{"entries":2,"bytes":32768,"segments":2,"segment_bytes":32768,"per_source_quota":0,"physical_bytes":65536}},
    {"id":"wal_scratch_alpha_b","resource_kind":"project_wal_scratch","scope_id":"project_alpha","quota_partition_id":"wal_scratch_b","root_id":"project_alpha_storage_root","physical_domain":"project_alpha_volume","maxima":{"entries":2,"bytes":32768,"segments":2,"segment_bytes":32768,"per_source_quota":0,"physical_bytes":65536}},
    {"id":"wal_scratch_beta_a","resource_kind":"project_wal_scratch","scope_id":"project_beta","quota_partition_id":"wal_scratch_a","root_id":"project_beta_storage_root","physical_domain":"project_beta_volume","maxima":{"entries":2,"bytes":32768,"segments":2,"segment_bytes":32768,"per_source_quota":0,"physical_bytes":65536}},
    {"id":"wal_scratch_beta_b","resource_kind":"project_wal_scratch","scope_id":"project_beta","quota_partition_id":"wal_scratch_b","root_id":"project_beta_storage_root","physical_domain":"project_beta_volume","maxima":{"entries":2,"bytes":32768,"segments":2,"segment_bytes":32768,"per_source_quota":0,"physical_bytes":65536}},
    {"id":"derived_live","resource_kind":"derived_log_live","scope_id":"global","quota_partition_id":"derived_live","root_id":"allocator_root","physical_domain":"allocator_volume","maxima":{"entries":2,"bytes":65536,"segments":2,"segment_bytes":65536,"per_source_quota":2,"physical_bytes":131072}},
    {"id":"derived_scratch_a","resource_kind":"derived_log_scratch","scope_id":"global","quota_partition_id":"derived_scratch_a","root_id":"allocator_root","physical_domain":"allocator_volume","maxima":{"entries":2,"bytes":65536,"segments":2,"segment_bytes":65536,"per_source_quota":2,"physical_bytes":131072}},
    {"id":"derived_scratch_b","resource_kind":"derived_log_scratch","scope_id":"global","quota_partition_id":"derived_scratch_b","root_id":"allocator_root","physical_domain":"allocator_volume","maxima":{"entries":2,"bytes":65536,"segments":2,"segment_bytes":65536,"per_source_quota":2,"physical_bytes":131072}},
    {"id":"journal_l1_alpha","resource_kind":"canonical_journal_live","scope_id":"project_alpha","quota_partition_id":"l1_floor","root_id":"project_alpha_storage_root","physical_domain":"project_alpha_volume","maxima":{"entries":1,"bytes":16384,"segments":1,"segment_bytes":16384,"per_source_quota":0,"physical_bytes":32768}},
    {"id":"journal_semantic_alpha","resource_kind":"canonical_journal_live","scope_id":"project_alpha","quota_partition_id":"semantic_live","root_id":"project_alpha_storage_root","physical_domain":"project_alpha_volume","maxima":{"entries":2,"bytes":32768,"segments":2,"segment_bytes":32768,"per_source_quota":0,"physical_bytes":65536}},
    {"id":"journal_l1_beta","resource_kind":"canonical_journal_live","scope_id":"project_beta","quota_partition_id":"l1_floor","root_id":"project_beta_storage_root","physical_domain":"project_beta_volume","maxima":{"entries":1,"bytes":16384,"segments":1,"segment_bytes":16384,"per_source_quota":0,"physical_bytes":32768}},
    {"id":"journal_semantic_beta","resource_kind":"canonical_journal_live","scope_id":"project_beta","quota_partition_id":"semantic_live","root_id":"project_beta_storage_root","physical_domain":"project_beta_volume","maxima":{"entries":2,"bytes":32768,"segments":2,"segment_bytes":32768,"per_source_quota":0,"physical_bytes":65536}},